{
  "$schema": "./tools/cairn-config.schema.json",
  "version": 2,
  "trunk": "main",
  "remote": "origin",
  "metadataNamespace": "cairn",
  "enforcementProfile": "ci",
  "roots": {
    "documentation": "docs",
    "project": "project",
    "architecture": "docs/architecture",
    "decisions": "docs/adr",
    "modules": "docs/modules",
    "concepts": "spec/concepts",
    "source": [
      "tools",
      "site"
    ]
  },
  "areas": [
    {
      "name": "application",
      "match": [
        "tools/**"
      ],
      "note": "docs/modules/application.md"
    },
    {
      "name": "site",
      "match": [
        "site/**"
      ],
      "note": "docs/modules/site.md"
    }
  ],
  "defaultRoute": "lightweight",
  "checkpointRetentionRef": null,
  "pathHistoryPolicy": "forbidden",
  "scopeDigestAlgorithm": "sha256",
  "transport": {
    "registration": "manual-git",
    "integration": "pull-request"
  },
  "migration": {
    "unregisteredPaths": [],
    "undeclaredOpenings": [],
    "v02Records": []
  }
}
